results/logs/cpu_sanity_log.csv

epoch,train_loss,val_loss,val_f1,val_auc
0,0.6932071447372437,0.6768596172332764,0.6670619626445301,0.6649983209876543
1,0.6780972480773926,0.6637734174728394,0.6882018151053684,0.7265128888888889
2,0.6660140156745911,0.6515438556671143,0.70361597978841,0.7536548148148148
3,0.65449059009552,0.6397001147270203,0.7669409910698651,0.778005925925926
4,0.6431446075439453,0.6280950903892517,0.7820147979510529,0.7937466666666666
5,0.6320968866348267,0.6167380809783936,0.7804081632653062,0.8035664197530864
6,0.622044026851654,0.6055959463119507,0.7658282740676496,0.8071043950617284
7,0.6118143200874329,0.5947936773300171,0.7573991031390135,0.8071328395061728
8,0.6013960242271423,0.5843170285224915,0.7482179811450909,0.808025086419753
9,0.591402530670166,0.5741708278656006,0.7427637721755369,0.8096837530864198
10,0.5820057392120361,0.5642374157905579,0.7439568176484394,0.813274074074074
11,0.5729125738143921,0.5543711185455322,0.7501769285208776,0.8181983209876544
12,0.5634250640869141,0.5445770025253296,0.7581023954908408,0.8235238518518518
13,0.5536065101623535,0.5347908735275269,0.769266589057043,0.8298690370370371
14,0.5427010655403137,0.525006115436554,0.7761332099907493,0.8363939753086419
15,0.5337560772895813,0.515083909034729,0.7846012832263978,0.8432781234567901
16,0.5243422389030457,0.5049200057983398,0.7919340054995417,0.8502632098765431
17,0.5135579109191895,0.4944569766521454,0.7974423384334323,0.8577407407407408
18,0.5035618543624878,0.48365044593811035,0.803178206583428,0.8658701234567902
19,0.4926546812057495,0.4726933538913727,0.8079440306928458,0.8738687407407407

probelm_scope.md

PS C:\Users\praty\OneDrive\Desktop\DGA_ISRO> (Set-ExecutionPolicy -Scope Process -ExecutionPolicy RemoteSigned) ; (& c:\Users\praty\OneDrive\Desktop\DGA_ISRO\.venv-laptop\Scripts\Activate.ps1)
(.venv-laptop) PS C:\Users\praty\OneDrive\Desktop\DGA_ISRO> python src\scripts\01_parse_zenodo_unified.py
domains -> 30000 rows
dns -> 30000 rows
whois -> 30000 rows
asn -> 34521 rows
(.venv-laptop) PS C:\Users\praty\OneDrive\Desktop\DGA_ISRO> python src\scripts\02_build_node_tables.py
Node tables built: 30000 domains, 23782 IPs, 13731 nameservers, 970 registrars, 2320 ASNs
(.venv-laptop) PS C:\Users\praty\OneDrive\Desktop\DGA_ISRO> python src\scripts\03_build_edges_snapshots.py
C:\Users\praty\OneDrive\Desktop\DGA_ISRO\src\scripts\03_build_edges_snapshots.py:34: UserWarning: Converting to PeriodArray/Index representation will drop timezone information.
  domains["week"] = domains["evaluated_on"].dt.to_period("W").astype(str)
Saved domain_snapshot_id.csv
Built 28 snapshots
(.venv-laptop) PS C:\Users\praty\OneDrive\Desktop\DGA_ISRO> python src\scripts\04_build_heterodata.py
snapshot_0 saved
snapshot_1 saved
snapshot_2 saved
snapshot_3 saved
snapshot_4 saved
snapshot_5 saved
snapshot_6 saved
snapshot_7 saved
snapshot_8 saved
snapshot_9 saved
snapshot_10 saved
snapshot_11 saved
snapshot_12 saved
snapshot_13 saved
snapshot_14 saved
snapshot_15 saved
snapshot_16 saved
snapshot_17 saved
snapshot_18 saved
snapshot_19 saved
snapshot_20 saved
snapshot_21 saved
snapshot_22 saved
snapshot_23 saved
snapshot_24 saved
snapshot_25 saved
snapshot_26 saved
snapshot_27 saved
Labels saved
(.venv-laptop) PS C:\Users\praty\OneDrive\Desktop\DGA_ISRO> python -c "import pandas as pd; df = pd.read_csv('data_processed/enriched/domains.csv'); print(df['label'].value_counts())"
label
malicious    15000
benign       15000
Name: count, dtype: int64
(.venv-laptop) PS C:\Users\praty\OneDrive\Desktop\DGA_ISRO> python -c "import pandas as pd; df = pd.read_csv('data_processed/graphs/domain_snapshot_id.csv'); print(df.shape); print(df['snapshot_id'].value_counts().sort_index())"
(30000, 2)
snapshot_id
0     1970
1     7834
2     4148
3        5
4     5241
5       38
6      354
7     1057
8     2520
9     2059
10      62
11      28
12     169
13       6
14       4
15       4
16      47
17      10
18      54
19     189
20      24
21       8
22       8
23     307
24    3529
25     146
26      97
27      82
Name: count, dtype: int64
python src\scripts\nodes_edges_count.py
Total nodes: 70803 {'domain': 30000, 'ip': 23782, 'nameserver': 13731, 'registrar': 970, 'asn': 2320}
Total edges: 145409 {'resolves_to': 43338, 'shares_ns': 58017, 'registered_by': 18529, 'belongs_asn': 25525}
(.venv-laptop) PS C:\Users\praty\OneDrive\Desktop\DGA_ISRO> python tests\test_full_model.py
Output shape: torch.Size([20, 2])
PASSED
(.venv-laptop) PS C:\Users\praty\OneDrive\Desktop\DGA_ISRO> python src\scripts\06_create_split.py
train 21000
val 4500
test 4500
(.venv-laptop) PS C:\Users\praty\OneDrive\Desktop\DGA_ISRO> python src\scripts\07_cpu_sanity_check.py
Sanity check running on: cpu
epoch 0: train_loss=0.6932 val_loss=0.6769 val_f1=0.6671 val_auc=0.6650
epoch 1: train_loss=0.6781 val_loss=0.6638 val_f1=0.6882 val_auc=0.7265
epoch 2: train_loss=0.6660 val_loss=0.6515 val_f1=0.7036 val_auc=0.7537
epoch 3: train_loss=0.6545 val_loss=0.6397 val_f1=0.7669 val_auc=0.7780
epoch 4: train_loss=0.6431 val_loss=0.6281 val_f1=0.7820 val_auc=0.7937
epoch 5: train_loss=0.6321 val_loss=0.6167 val_f1=0.7804 val_auc=0.8036
epoch 6: train_loss=0.6220 val_loss=0.6056 val_f1=0.7658 val_auc=0.8071
epoch 7: train_loss=0.6118 val_loss=0.5948 val_f1=0.7574 val_auc=0.8071
epoch 8: train_loss=0.6014 val_loss=0.5843 val_f1=0.7482 val_auc=0.8080
epoch 9: train_loss=0.5914 val_loss=0.5742 val_f1=0.7428 val_auc=0.8097
epoch 10: train_loss=0.5820 val_loss=0.5642 val_f1=0.7440 val_auc=0.8133
epoch 11: train_loss=0.5729 val_loss=0.5544 val_f1=0.7502 val_auc=0.8182
epoch 12: train_loss=0.5634 val_loss=0.5446 val_f1=0.7581 val_auc=0.8235
epoch 13: train_loss=0.5536 val_loss=0.5348 val_f1=0.7693 val_auc=0.8299
epoch 14: train_loss=0.5427 val_loss=0.5250 val_f1=0.7761 val_auc=0.8364
epoch 15: train_loss=0.5338 val_loss=0.5151 val_f1=0.7846 val_auc=0.8433
epoch 16: train_loss=0.5243 val_loss=0.5049 val_f1=0.7919 val_auc=0.8503
epoch 17: train_loss=0.5136 val_loss=0.4945 val_f1=0.7974 val_auc=0.8577
epoch 18: train_loss=0.5036 val_loss=0.4837 val_f1=0.8032 val_auc=0.8659
epoch 19: train_loss=0.4927 val_loss=0.4727 val_f1=0.8079 val_auc=0.8739
CPU sanity check complete. (.venv-laptop) PS
.venv-laptop) PS C:\Users\praty\OneDrive\Desktop\DGA_ISRO> dir models\checkpoints
>> type results\logs\train_log.csv